{
  "expansion_policy": {
    "formal_generation_requires_independent_approval": true,
    "required_case_types": [
      "normal",
      "known_single_fault",
      "known_multifault",
      "unknown_fault",
      "data_quality",
      "operating_condition_shift"
    ]
  },
  "protocol_version": "G1.1",
  "rows": [
    {
      "capability_id": "whole_spacecraft.unified_native.v1",
      "effect_ids": [],
      "object_id": "whole_spacecraft",
      "required_case_types": [
        "normal",
        "known_single_fault",
        "known_multifault",
        "unknown_fault",
        "data_quality",
        "operating_condition_shift"
      ],
      "scenario_id": "whole.nominal_mission",
      "scenario_type": "nominal",
      "split_group": "development",
      "support_status": "SUPPORTED"
    },
    {
      "capability_id": "whole_spacecraft.unified_native.v1",
      "effect_ids": [
        "payload_instrument_off",
        "adcs_rw_jamming",
        "adcs_rw_motor_failure",
        "gyro_bias_step",
        "comm_data_downlink_link_loss",
        "eps_battery_capacity_loss",
        "propulsion_thruster_ignition_failure"
      ],
      "object_id": "whole_spacecraft",
      "required_case_types": [
        "normal",
        "known_single_fault",
        "known_multifault",
        "unknown_fault",
        "data_quality",
        "operating_condition_shift"
      ],
      "scenario_id": "whole.subsystem_failure_propagation",
      "scenario_type": "fault",
      "split_group": "development",
      "support_status": "SUPPORTED"
    },
    {
      "capability_id": "whole_spacecraft.unified_native.v1",
      "effect_ids": [
        "solar_panel_efficiency_loss",
        "gyro_noise_increase",
        "rw_friction_degradation",
        "thermal_radiator_rejection_loss",
        "propulsion_burn_impulse_loss"
      ],
      "object_id": "whole_spacecraft",
      "required_case_types": [
        "normal",
        "known_single_fault",
        "known_multifault",
        "unknown_fault",
        "data_quality",
        "operating_condition_shift"
      ],
      "scenario_id": "whole.resource_margin_degradation",
      "scenario_type": "degradation",
      "split_group": "development",
      "support_status": "SUPPORTED"
    },
    {
      "capability_id": "subsystem.adcs_unified_native.v1",
      "effect_ids": [],
      "object_id": "subsystem.adcs",
      "required_case_types": [
        "normal",
        "known_single_fault",
        "known_multifault",
        "unknown_fault",
        "data_quality",
        "operating_condition_shift"
      ],
      "scenario_id": "adcs.nominal_pointing",
      "scenario_type": "nominal",
      "split_group": "validation",
      "support_status": "SUPPORTED"
    },
    {
      "capability_id": "subsystem.adcs_unified_native.v1",
      "effect_ids": [
        "adcs_rw_jamming",
        "adcs_rw_motor_failure",
        "gyro_bias_step"
      ],
      "object_id": "subsystem.adcs",
      "required_case_types": [
        "normal",
        "known_single_fault",
        "known_multifault",
        "unknown_fault",
        "data_quality",
        "operating_condition_shift"
      ],
      "scenario_id": "adcs.actuator_or_sensor_failure",
      "scenario_type": "fault",
      "split_group": "validation",
      "support_status": "SUPPORTED"
    },
    {
      "capability_id": "subsystem.adcs_unified_native.v1",
      "effect_ids": [
        "gyro_noise_increase",
        "rw_friction_degradation",
        "adcs_rw_torque_authority_loss"
      ],
      "object_id": "subsystem.adcs",
      "required_case_types": [
        "normal",
        "known_single_fault",
        "known_multifault",
        "unknown_fault",
        "data_quality",
        "operating_condition_shift"
      ],
      "scenario_id": "adcs.pointing_authority_degradation",
      "scenario_type": "degradation",
      "split_group": "validation",
      "support_status": "SUPPORTED"
    },
    {
      "capability_id": "subsystem.propulsion.unified_native.v1",
      "effect_ids": [],
      "object_id": "subsystem.propulsion",
      "required_case_types": [
        "normal",
        "known_single_fault",
        "known_multifault",
        "unknown_fault",
        "data_quality",
        "operating_condition_shift"
      ],
      "scenario_id": "propulsion.nominal_burn",
      "scenario_type": "nominal",
      "split_group": "holdout",
      "support_status": "SUPPORTED"
    },
    {
      "capability_id": "subsystem.propulsion.unified_native.v1",
      "effect_ids": [
        "thrust_or_feed_failure"
      ],
      "object_id": "subsystem.propulsion",
      "required_case_types": [
        "normal",
        "known_single_fault",
        "known_multifault",
        "unknown_fault",
        "data_quality",
        "operating_condition_shift"
      ],
      "scenario_id": "propulsion.thrust_or_feed_failure",
      "scenario_type": "fault",
      "split_group": "holdout",
      "support_status": "SUPPORTED"
    },
    {
      "capability_id": "subsystem.propulsion.unified_native.v1",
      "effect_ids": [
        "performance_degradation"
      ],
      "object_id": "subsystem.propulsion",
      "required_case_types": [
        "normal",
        "known_single_fault",
        "known_multifault",
        "unknown_fault",
        "data_quality",
        "operating_condition_shift"
      ],
      "scenario_id": "propulsion.performance_degradation",
      "scenario_type": "degradation",
      "split_group": "holdout",
      "support_status": "SUPPORTED"
    },
    {
      "capability_id": "subsystem.eps.unified_native.v1",
      "effect_ids": [],
      "object_id": "subsystem.eps",
      "required_case_types": [
        "normal",
        "known_single_fault",
        "known_multifault",
        "unknown_fault",
        "data_quality",
        "operating_condition_shift"
      ],
      "scenario_id": "eps.nominal_power_balance",
      "scenario_type": "nominal",
      "split_group": "development",
      "support_status": "SUPPORTED"
    },
    {
      "capability_id": "subsystem.eps.unified_native.v1",
      "effect_ids": [
        "generation_storage_distribution_failure"
      ],
      "object_id": "subsystem.eps",
      "required_case_types": [
        "normal",
        "known_single_fault",
        "known_multifault",
        "unknown_fault",
        "data_quality",
        "operating_condition_shift"
      ],
      "scenario_id": "eps.generation_storage_distribution_failure",
      "scenario_type": "fault",
      "split_group": "development",
      "support_status": "SUPPORTED"
    },
    {
      "capability_id": "subsystem.eps.unified_native.v1",
      "effect_ids": [
        "energy_margin_degradation"
      ],
      "object_id": "subsystem.eps",
      "required_case_types": [
        "normal",
        "known_single_fault",
        "known_multifault",
        "unknown_fault",
        "data_quality",
        "operating_condition_shift"
      ],
      "scenario_id": "eps.energy_margin_degradation",
      "scenario_type": "degradation",
      "split_group": "development",
      "support_status": "SUPPORTED"
    },
    {
      "capability_id": "subsystem.thermal.basic_lumped.v1",
      "effect_ids": [],
      "object_id": "subsystem.thermal",
      "required_case_types": [
        "normal",
        "known_single_fault",
        "known_multifault",
        "unknown_fault",
        "data_quality",
        "operating_condition_shift"
      ],
      "scenario_id": "thermal.nominal_regulation",
      "scenario_type": "nominal",
      "split_group": "validation",
      "support_status": "SUPPORTED"
    },
    {
      "capability_id": "subsystem.thermal.basic_lumped.v1",
      "effect_ids": [
        "heating_or_rejection_failure"
      ],
      "object_id": "subsystem.thermal",
      "required_case_types": [
        "normal",
        "known_single_fault",
        "known_multifault",
        "unknown_fault",
        "data_quality",
        "operating_condition_shift"
      ],
      "scenario_id": "thermal.heating_or_rejection_failure",
      "scenario_type": "fault",
      "split_group": "validation",
      "support_status": "SUPPORTED"
    },
    {
      "capability_id": "subsystem.thermal.basic_lumped.v1",
      "effect_ids": [
        "radiator_degradation_factor"
      ],
      "object_id": "subsystem.thermal",
      "required_case_types": [
        "normal",
        "known_single_fault",
        "known_multifault",
        "unknown_fault",
        "data_quality",
        "operating_condition_shift"
      ],
      "scenario_id": "thermal.control_margin_degradation",
      "scenario_type": "degradation",
      "split_group": "validation",
      "support_status": "SUPPORTED"
    },
    {
      "capability_id": "subsystem.payload.source_native.v1",
      "effect_ids": [],
      "object_id": "subsystem.payload",
      "required_case_types": [
        "normal",
        "known_single_fault",
        "known_multifault",
        "unknown_fault",
        "data_quality",
        "operating_condition_shift"
      ],
      "scenario_id": "payload.nominal_observation",
      "scenario_type": "nominal",
      "split_group": "holdout",
      "support_status": "SUPPORTED"
    },
    {
      "capability_id": "subsystem.payload.source_native.v1",
      "effect_ids": [
        "instrument_failure"
      ],
      "object_id": "subsystem.payload",
      "required_case_types": [
        "normal",
        "known_single_fault",
        "known_multifault",
        "unknown_fault",
        "data_quality",
        "operating_condition_shift"
      ],
      "scenario_id": "payload.instrument_failure",
      "scenario_type": "fault",
      "split_group": "holdout",
      "support_status": "SUPPORTED"
    },
    {
      "capability_id": "subsystem.payload.source_native.v1",
      "effect_ids": [
        "quality_or_rate_degradation"
      ],
      "object_id": "subsystem.payload",
      "required_case_types": [
        "normal",
        "known_single_fault",